chapter	chapter_title	verse_number	original_text	commentaries
12	Chapter - 12	13	"तेषु चिह्नेषु संस्थाप्य सूत्रं पञ्चाङ्गसम्मितम् ।  
सिद्ध्यर्थं कमलानां तु भ्रामयेत् पूर्ववत् क्रमात् ॥ १३ ॥"	[]
12	Chapter - 12	14	"एवं स्यात् पञ्चपत्राणां पद्मानां क्षेत्रपञ्चकम् ।  
मध्यपद्मं भवेच्छुक्लं पञ्चकं पाण्डुरोज्ज्वलम् ॥ १४ ॥"	[]
12	Chapter - 12	15	"पीता स्यात् कर्णिका तेषां रक्तरागेण केसराः ।  
प्रतिपत्रान्तरे तेषु पद्मेषु केसरत्रयम् ॥ १५ ॥"	[]
12	Chapter - 12	16	"पद्मानां साधनार्थ तु यत् प्राग्वृत्तत्रयं (ग्, घ्: प्राग्वृत्तित्रयम्) द्विज ।  
भ्रामितं तस्य मध्यं तु रजसा परिपूरयेत् ॥ १६ ॥"	[]
12	Chapter - 12	17	"इन्द्रनीलोपमेनैव तन्नालं पद्मसन्ततेः ।  
दलान्तराणि सर्वेषां मध्यभागादितः (ग्, घ्: मध्यपद्मादितः) क्रमात् ॥ १७ ॥"	[]
12	Chapter - 12	18	"नृपाश्मरुचिरागेण क्षेत्रान्तं परिपूरयेत् ।  
मध्यवत् सर्वपद्मानां व्योमवृत्तं न कल्पयेत् ॥ १८ ॥"	[]
12	Chapter - 12	19	"निष्पाद्य मध्यपद्मे तु बिम्बेशं सम्प्रपूजयेत् ।  
सर्वारकर्णिकामध्यात्तदेव विधिवद्यजेत् ॥ १९ ॥"	[]
12	Chapter - 12	20	"पञ्चकं पुरुषाद्यं यत् पूर्वपद्मे प्रपूजितम् ।  
क्रमेण पूर्वपद्माभ्यां (ग्, घ्: पूर्वपत्रं यत्) यावदीशानगोचरम् ॥ २० ॥"	[]
12	Chapter - 12	21	"प्रादक्षिण्येन सर्वेषां क्षंअं (ग्, घ्: क्षमां तत्व) तत्त्वगणं न्यसेत् ।  
न्यस्य सम्पूज्य पाद्यार्घ्यपुष्पधूपविलेपनैः ॥ २१ ॥"	[]
12	Chapter - 12	22	"अनन्तरूपो भगवान् (क्, ख्, घ्: भगवान् * * * ली) वनमाली तु यस्स्मृतः ।  
अभीप्सितैरतः (ग्, घ्: -रधः कुर्यात्) कुर्यादरकैर्बीजचक्रकम् ॥ २२ ॥"	[]
12	Chapter - 12	23	"उत्तमं द्वादशारं तु तच्च (क्, ख्: तच्छते दीपिता) ते विदिता पुरा ।  
कालक्रमाभिधास्सर्वा (क्, ख्: जलक्रमा) सृक्षादौ ? च क्रमं यजेत् ॥ २३ ॥"	[]
12	Chapter - 12	24	"षटसु चाङ्गेषु विधिवन्नेम्यन्तेषु च सत्तम ।  
स्थूलसूक्ष्मविभागेन यथा तत् ते ब्रवीम्यहम् ॥ २४ ॥"	[]
12	Chapter - 12	25	"प्राणो (क्, ख्: प्राणो ह्यक्षस्थविता सिद्धमनामिभ्रातु विनाडिका) ह्यक्षस्थितो सिद्धं ? ताभिस्स्यात्तु विनाडिका ।  
ब्रह्मन् विद्धि वा व स्वरागता * * * * ॥ २५ ॥"	[]
12	Chapter - 12	26	"प्रधिषु (ग्, घ्: प्रथिष्ववस्थितो) प्रस्थितो मासो नेमिभागेषु वत्सराः ।  
स्थूलमेतत् समाख्यातं सूक्ष्मकालमथ शृणु ॥ २६ ॥"	[]
12	Chapter - 12	27	"उपोष्टको ? निमेषश्च ततस्त्रुटिलवौ द्विज ।  
लक्षणं च तथा काष्ठात् पक्षादोपरिसंस्थिता ? (क्, ख्: पक्षादेरापरि) ॥ २७ ॥"	[]
12	Chapter - 12	28	"एतस्मिन् कालचक्रे तु प्रवर्तकनिवर्तके ।  
पद्ममध्ये यजेत् साङ्गं प्रद्युम्नं परिमार्जितम् ॥ २८ ॥"	[]
13	Chapter - 13	1	"चण्डानदीधियन् ? बिम्बमनन्तकरभासुरम् ।  
सुरासुरेन्द्रनिमितं शृणु तामप ? सोदरम् ॥ १ ॥"	[]
13	Chapter - 13	2	"पञ्चपद्मप्रसिद्ध्यर्थं क्षेत्रं प्राग्भाजितं यथा ।  
संविभज्य तथा ब्रह्मन् सूर्यबिम्बप्रसिद्धये ॥ २ ॥"	[]
13	Chapter - 13	3	"पङ्कजद्वादशांशेन भागं पद्मबहिस्त्यजेत् ।  
द्वे वृत्ते भ्रामयेत् पश्चाद्भागीकृत्वांशपञ्चकम् ॥ ३ ॥"	[]
13	Chapter - 13	4	"प्रतप्तकरबिम्बं तद्बहिर्भार्गवपञ्चकम् ।  
संस्थाप्य रश्मिसिद्ध्यर्थं भ्राम्य वृत्तं तृतीयकम् ॥ ४ ॥"	[]
13	Chapter - 13	5	"रश्मिपुञ्जस्य पीठस्य भागमध्ये परित्यजेत् ।  
पर्यन्ते सूर्यबिम्बस्य सूत्रं कृत्वाऽथ सत्तम ॥ ५ ॥"	[]
13	Chapter - 13	6	"प्रसार्य रश्मिपर्यन्तं यावदास्थालकं तु तत् ।  
एकांशं दद्यमानं ? तु त्यक्त्वा सूत्रस्य चान्तरे ॥ ६ ॥"	[]
13	Chapter - 13	7	"सम्प्रसार्य तथा सूत्रं पातयित्वा द्विजापरम् ।  
क्रमेणानेन वै दद्याद् रध्यर्थं (ग्, घ्: रम्यार्थम्) सूत्रपञ्चकम् ॥ ७ ॥"	[]
13	Chapter - 13	8	"यं (ग्, घ्: यं अं खं सूर्यबिम्बस्य मालवद्भिरवब्जज ?) अं सूर्यस्य बिम्बस्य माल्प * * * * रववज्ज ।  
ततः प्रसार्य रजसा रविवद्राजते यथा ॥ ८ ॥"	[]
13	Chapter - 13	9	"रक्तारुणेन रागेण हितैर्मध्यान्तमेव (ग्, घ्: शतैर्मध्योन्तमेव च) च ।  
बिम्बं भाति यथा सम्यक् तेजोगोलकरूपवत् ॥ ९ ॥"	[]
13	Chapter - 13	10	"पाण्डुरारुणरागेण सूक्ष्मरेखाचयेन च ।  
चक्रेण यत्ततं ? (ग्, घ्: यत्नतम्) कुर्याद्गोपुच्छादिव गोणकम् ॥ १० ॥"	[]
13	Chapter - 13	11	"रश्मीनामन्तरं सर्वं रश्मिबाह्यात् तथैव च ।  
छायेन्द्ररजसा ब्रह्मन् विघनाम्बररूपिणीम् ॥ ११ ॥"	[]
13	Chapter - 13	12	"प्राग्वत्तदुत्तरे कुर्यात् कमलं शुभलक्षणम् ।  
न मध्यै धरया (ग्, घ्: न मध्ये यरया) भक्त्या यः पूरयति जह्वगम् ? ॥ १२ ॥"	[]
13	Chapter - 13	13	"सोऽचिरात् (क्, ख्: इदमर्धं गलितम्) परमं ब्रह्म प्रविशत्यजमव्ययम् ।  
यद्गत्वा न निवर्तन्ते भूयोऽस्मिन् भवपङ्जरे ॥ १३ ॥"	[]
14	Chapter - 14	1	"सुधारसमयारं (ग्, घ्: सुधारसामियाकामा) तु ? तुषारनिचयाकृतिम् ।  
हारपञ्जलसारस्य ? बहिस्थश्चारु राजते ॥ १ ॥"	[]
14	Chapter - 14	2	"तामिदानीं प्रवक्ष्यामि बिम्बार्थेषु च सञ्ज्ञितः ।  
अङ्कयित्वाऽष्टधा क्षेत्रं दिग्द्वयाद्दक्षिणोत्तरम् ॥ २ ॥"	[]
14	Chapter - 14	3	"क्षेत्रं सूत्रद्वयेनैव युक्तानि नवसङ्ख्यया ।  
एवं पूर्वापरं सूत्रं क्षेत्रमध्ये तु पातयेत् ॥ ३ ॥"	[]
14	Chapter - 14	4	"द्वे वाऽन्ये क्षेत्रजे सूत्रे त्रिण्येवं पूर्वपश्चिमे ।  
प्राच्यादौ सङ्ख्यमानं यत् पौष्करांशं तृतीयकम् ॥ ४ ॥"	[]
14	Chapter - 14	5	"संविभज्य चतुर्धा तत् ब्रह्मस्थानावधेस्समम् ।  
सुपत्यैरङ्कयेच्चिह्नैस्त्रिभिः (ग्, घ्: सुवक्यैरङ्क) कमलसम्भव ॥ ५ ॥"	[]
14	Chapter - 14	6	"त्यक्त्वा तस्माच्चतुर्थांशं प्राग्दिग्भागद्वयोपमम् ।  
सूत्रं कृत्वा तदङ्गस्थमनेन विधिना ततः ॥ ६ ॥"	[]
14	Chapter - 14	7	"प्रवासा ऋग्यजुत्या च ? (ग्: प्रवासा ऋग्यजात्या च; घ्: प्रवासा ऋश्यजात्या च) यावत् सूत्रं तु सप्तकम् ।  
तस्मात्तल्लाञ्छयमानं तु दक्षिणे तु समानयेत् ॥ ७ ॥"	[]
14	Chapter - 14	8	"यावद्द्वे द्वितयं सूत्रमुदग्दिग्दलाञ्छनं तथा ।  
एवं मध्येन्दुवच्चिह्नं प्रथमं परिकल्पयेत् ॥ ८ ॥"	[]
14	Chapter - 14	9	"सिद्ध्यर्थमर्धचन्द्राख्यं बिम्बस्यावरमुच्यते ।  
अंसाभिधाच्चतुर्थस्य * * * * र्थ * * * * ते * * मस्य च ? ॥ ९ ॥"	[]
14	Chapter - 14	10	"तं तु कृत्वा नयेत् पश्चाच्छृङ्गं प्राग्वञ्चनस्य च ।  
एकं तस्माल्लाञ्छ्यमानं द्वितीयं शृङ्गमानयेत् ॥ १० ॥"	[]
14	Chapter - 14	11	"कृत्वैवमिन्दुलेखेन त्वर्धेन्दुर्जायतेऽधिकम् ।  
सुपूरणीयं रजसा यथा तदधुनोच्यते ॥ ११ ॥"	[]
14	Chapter - 14	12	"सितपीतेन रागेण समं रेखासु पूरयेत् (ग्, घ्: पूजयेत्) ।  
लाञ्छनद्वितयं चन्द्रं किञ्चित् स्थूलासु मध्यतः ॥ १२ ॥"	[]
14	Chapter - 14	13	"कृशासु शृङ्गदेशाच्च क्रमाद्गोपुच्छरूपवत् ।  
प्रसार्य (ग्, घ्: प्रसूर्यमर्धात्) मध्याच्छुक्लेन तद्गर्भेऽम्बुरुहं लिखेत् ॥ १३ ॥"	[]
14	Chapter - 14	14	"ब्रह्मस्थानाच्च यत् सूत्रं कृत्वा सं ? सम्प्रसार्य च ।  
चन्द्रोदयसमीपं (क्, ख्: चन्द्रोथ * * * समीपम्) तु यथा चन्द्रं तु संस्पृशेत् ॥ १४ ॥"	[]
14	Chapter - 14	15	"तद्भ्राम्य पद्मसिद्ध्यर्थं पद्मपत्रायतेक्षणम् ।  
यजेच्चन्द्रोदरस्थं च नारायणमनामयम् ॥ १५ ॥"	[]
15	Chapter - 15	1	"वैराजीया विभोश्शकिर्ब्रमतत्त्वेति कीर्त्यते ।  
त्रिस्कन्धलक्षणं यागं तस्य वक्ष्यामि तेऽधुना ॥ १ ॥"	[]
15	Chapter - 15	2	"कृत्वा ब्रह्मपदे सूत्रं चतुरश्रस्य सत्तम ।  
क्षेत्रार्धं पश्चिमाद्भागाल्लाञ्छयेदर्धचन्द्रवत् ॥ २ ॥"	[]
15	Chapter - 15	3	"ततो वै पूर्वदिङ्मध्यं सूत्रं कृत्वाऽत्मयत्नतः ।  
नयेत् पश्चिमदिङ्क्मध्ये तेन सूत्रेण लाञ्छयेत् ॥ ३ ॥"	[]
15	Chapter - 15	4	"समीपाद्यातुदिग् (क्, ख्: दिक् साधो) वायोश्चतुरश्रपुरं ह्ययम् ।  
सूत्रद्वयमुदग्याम्ये संस्थितं कमलोद्भव ॥ ४ ॥"	[]
15	Chapter - 15	5	"दिग्यात्वन्ते (ग्, घ्: दिश्यात्वङ्के कृतम्) तु तत् सूत्रं त्रिकोणं व्यजने ततः ।  
प्राग्वदुत्पाद्य मध्ये (ग्, घ्: मध्येतु त्रिकोणं * * * * वरम्) तु * * * * कोणपर ? ॥ ५ ॥"	[]
15	Chapter - 15	6	"ताभ्यामभ्यन्तरं कुर्यात् तृतीयभ्रमसिद्धये ।  
यथा सूत्रत्रयोपेतं स्यात् त्रिकोणचतुष्टयम् ॥ ६ ॥"	[]
15	Chapter - 15	7	"स्कन्धत्रयक्रमेणैव सोम्ययाम्यं तु पश्चिमे ।  
सूत्रपातं ततः कुर्याच्छिन्ने क्रुद्धे ? तु तन्तुना ॥ ७ ॥"	[]
15	Chapter - 15	8	"स्कन्धाभ्यां सौम्ययाम्याम्यां सौम्यापाभ्यां (क्, ख्: सोम्यावाभ्याम्) तथैव च ।  
याम्यापाभ्यां (क्, ख्: याम्यावाभ्याम्) तु संस्थाभ्यां सूत्राणां तु तेन तु ॥ ८ ॥"	[]
15	Chapter - 15	9	"एवमास्फालितैस्सूत्रैरंशकानां शतद्वयम् ।  
शतार्धं च शतान्येष जायते त्र्यंशरूपिणाम् ॥ ९ ॥"	[]
15	Chapter - 15	10	"शोभान्वितानि द्वाराणि कोणानि त्रीणि पौष्कर ।  
भागपङ्क्तिद्वयेनैव वक्ता ? तु भ्रमणीशुभम् ॥ १० ॥"	[]
15	Chapter - 15	11	"पङ्क्त्या तु साधयेत् पीठं सांशपङ्क्त्या तु पङ्कजम् ।  
इत्येतां कल्पनां कृत्वा लोपयेत्तदनन्तरम् ॥ ११ ॥"	[]
15	Chapter - 15	12	"दशकांशं दशानां तु दिङ्मध्याचारसिद्धये ।  
बाह्यपङ्क्तौ तु वै सप्त त्रेधा (ग्, घ्: त्रेधानि च) च * * * * चतुर्दश ॥ १२ ॥"	[]
15	Chapter - 15	13	"त्रीण्यन्ये योनिरूपाणि लोपयेदंशकानि च ।  
सप्तैतानि बहिः पङ्क्तौ लोपनीयान्यतोऽन्तरात् ॥ १३ ॥"	[]
15	Chapter - 15	14	"कर्णार्थं त्रीणि कोणस्थानि (ग्, घ्: कोणस्थानि (कोणानि ?)) द्वे योन्येकोऽग्नि ? च द्विज ।  
एवमाग्नेयपुरवदित्येते चांशकां दश ॥ १४ ॥"	[]
15	Chapter - 15	15	"संशोध्य द्वारसिद्ध्यर्थं कुर्याच्छोभाद्वयं ततः ।  
पश्चात् द्वये तु द्वारस्य त्रिंशत् (क्, ग्, घ्: त्वंशत् षट्) षट्कोण ? पौष्कर ॥ १५ ॥"	[]
15	Chapter - 15	16	"योनिवद्बाह्यपङ्क्तौ तु एवं पङ्चदशान्तरात् (ग्, घ्: पञ्चतदन्तरात्) ।  
त्रीण्यग्निपुररूपाणि मार्जयेद् द्वेऽथ योनिवत् ॥ १६ ॥"	[]
15	Chapter - 15	17	"व्यज्यते शोभनं शोभं ततः कोणं तु शोधयेत् ।  
स बाह्याभ्यन्तराभ्यां तु (क्, ख्: सबाह्याभ्यन्तरं तं तु) पङ्क्तिभ्यां त्रिंशदंशकम् ॥ १७ ॥"	[]
15	Chapter - 15	18	"द्वारद्वयं वा कृत्वाऽन्यत् प्राग्वच्छोभोपगं (क्, ख्: प्राग्वत् शोभावकम्) द्विज ।  
अंशकानां (क्, ख्: अंशकानां इत्याद्यर्धत्रयं गलितम्) तु दशकं शेषं कोणं तु शोधयेत् ॥ १८ ॥"	[]
15	Chapter - 15	19	"वीधीसंसिद्धये चैव पङ्क्त्येका या प्रकल्पिता ।  
भागास्तत्रैव पञ्चा म ? लोपयेत् परितो द्विज ॥ १९ ॥"	[]
15	Chapter - 15	20	"वीथ्यन्तर्गतपङ्क्तौ तु कुर्यात् पीठं सुलक्षणम् ।  
पञ्चत्रिकोणानि दिक्षु ? * * * * ब्र त्तत्र मार्जयेत् ॥ २० ॥"	[]
15	Chapter - 15	21	"हुताशपुरवत् (क्, ख्: हुताशपुरश्च) त्रीणि द्वेऽन्त्ययोन्योपमानि (ग्, घ्: देन्ये योन्योपमानि) च ।  
अंशषट्कं तु वै ब्रह्मन् प्रतिकोणं तु मार्जयेत् ॥ २१ ॥"	[]
15	Chapter - 15	22	"पद्मपीठान्तरे कुर्याच्छिष्टैष्षोडशकोष्ठकैः ।  
पृथक् सम्पूजनार्थं तु ह्येतल्लक्षणलक्षितम् ॥ २२ ॥"	[]
15	Chapter - 15	23	"कुर्याद् द्वारा च शक्तौ तु मण्डलं यन्मयोदितम् ।  
स लुप्तश्चतुरश्रं तु युक्तं रेखात्रयेण तु ॥ २३ ॥"	[]
15	Chapter - 15	24	"नवाध्वरस्य यागस्य यदाऽङ्गत्वेन वै व्रजेत् ।  
लुप्तवीथिं तथा कुर्याद्द्वारादिपरिभूषितम् ॥ २४ ॥"	[]
15	Chapter - 15	25	"मुक्तारेखात्रयेणैव चतुरश्रं पुरान्वितम् ।  
त्रिकोणं पूर्ववत् पूर्वं क्षेत्रं कृत्वा द्विसप्तधा ॥ २५ ॥"	[]
15	Chapter - 15	26	"विभज्य सुसमैर्भागैस्सूत्राण्यस्फाल्य पूर्ववत् ।  
अथ मन्त्रविशेषस्स्यादंशकानां तु मार्जयेत् ॥ २६ ॥"	[]
15	Chapter - 15	27	"शोभान्वितानि द्वाराणि भागैः पूर्वोदितैर्द्विज ।  
श (क्, ख्: श * * * * न्यंश; ग्, घ्: शयशेन्यंश) * * * * न्यंशकसव्येन कुर्यात् कोणत्रयं ततः ॥ २७ ॥"	[]
15	Chapter - 15	28	"पूर्ववत् पीठकोणेषु भागषट्कं तु मर्दयेत् ।  
दिक्त्रयादवशेषेण शोधयेदंशकानि (ग्, घ्: शोषयेदंशकानि) च ॥ २८ ॥"	[]
15	Chapter - 15	29	"पीठान्तर्वर्तिनिश्वासैरवशिष्टैस्तु पङ्कजम् ।  
लक्षणाढ्यं समं कुर्यात् कुर्याद्वा पीठवर्जितम् ॥ २९ ॥"	[]
15	Chapter - 15	30	"अथवा षोडशांशोत्थां पीठवत्युज्झितां (क्, ख्: पीठवदुज्झिताम्) लिखेत् ।  
यथा तु सङ्कटं न्यस्य पञ्चानां चाथ वक्ष्यते ॥ ३० ॥"	[]
15	Chapter - 15	31	"द्वाराणि सुसितेनैव पाण्डुरक्तेन चोत्तरम् ।  
कृष्णवर्णोन्तः ? (क्, ख्: तूर्णवर्णोन्त) दिग्भागं रञ्जनीयं च तेन वा ॥ ३१ ॥"	[]
15	Chapter - 15	32	"रक्तारुणेन तद्बाह्यमीशादौ वा सितादिना ।  
हुतभुङ्मारुतस्सूर्यः पीठकोणत्रये स्थिते ॥ ३२ ॥"	[]
15	Chapter - 15	33	"पूर्वमारुतविप्रेन्द्रदिक्त्रयेऽथ श्रुतित्रयम् ।  
सौम्ये (ग्, घ्: सौम्याप्यदक्षिण) च दक्षिणे चैव ऋग्यजुस्सामसञ्ज्ञितम् ॥ ३३ ॥"	[]
15	Chapter - 15	34	"सम्पाद्यैवं तदन्तस्थं ब्रह्मतत्त्वं तु योजयेत् ।  
परिवारावृतं ब्रह्मन् भक्त्या भोगैश्च याज्ञिकैः ॥ ३४ ॥"	[]
15	Chapter - 15	35	"तदर्पितं मनः कृत्वा सुवाचैव परिग्रहम् ।  
समाप्नोति शुभान् कामान् मोक्षार्थीं च परं पदम् ॥ ३५ ॥"	[]
16	Chapter - 16	1	"शृणु ब्रह्मन् प्रवक्ष्यामि यागं कूर्मोदरं तु यत् ।  
सप्तमं नवनाभस्य विष्णोस्सम्पूजनाय च ॥ १ ॥"	[]
16	Chapter - 16	2	"ऐशान्यां दिशि (ग्, घ्: दिशि वै कुर्या) वा कुर्याच्चक्रं कूर्मस्य सर्वदा ।  
रजसा चोल्लिखेत्तस्माद्विभागोद्योतितेन च ॥ २ ॥"	[]
