chapter	chapter_title	verse_number	original_text	commentaries
36	Chapter - 36	7	"अनुग्रहार्थं भविनामकृतज्ञाल्पमेधसाम् (क्, ख्, ग्, घ्: भविनां कृतज्ञाद्यल्पमेधसाम्) ।  
भक्तानामप्यभक्तानां नास्तिकानां तथैव च ॥ ७ ॥"	[]
36	Chapter - 36	8	"भूचक्राक्षं गते द्वीपे ह्यनादिप्रथितं हियत् ।  
क्षेत्रं स्वकर्मफलदं पुण्यं (ख्: पुंसः) परिमितं तु वै ॥ ८ ॥"	[]
36	Chapter - 36	9	"नृणामनुग्रार्थं तु स्थानभेदैरधिष्ठितम् ।  
अमूर्तेस्तु स्वसञ्ज्ञाभिः कारुण्यात् क्षेत्रसत्तमैः ॥ ९ ॥"	[]
36	Chapter - 36	10	"तथा क्षेत्राधिपैः किन्तु मूर्तैर्युक्ता नवाब्जज ? ।  
बीजभावेन भूमौ वा स्थितिं कृत्वा स्थितां (राम्) ततः ॥ १० ॥"	[]
36	Chapter - 36	11	"ज्ञानाद्यैर्वाणिमाद्यैस्तु अव्यक्तैः क्ष्मानलादिकैः ।  
तत्त्वबीजकलारूपैर्ब्रह्मसत्तासमन्वितैः ॥ ११ ॥"	[]
36	Chapter - 36	12	"सहावतीर्य चासृष्टेः प्राग्व्यक्तिं (क्, ख्, ग्: प्राग्व्यक्ति ययानुवै) यान्ति वै ततः ।  
स्वयमेवात्मभावेन (क्, ग्: स्वयमध्यात्मभावेन) सर्वानुग्रहकाम्यया ॥ १२ ॥"	[]
36	Chapter - 36	13	"क्ष्मामण्डलोपसंहारकालं क्षेत्रवरैस्सह ।  
वशित्वावरदेहांस्तु प्रधानमुनि * * * ? ॥ १३ ॥"	[]
36	Chapter - 36	14	"स्वस्मिम् स्वस्मिन् हि युगपत् क्षेत्रे क्षेमगतिप्रदे ।  
स्वकामनैकभूतां च ? चैवाभिममानिकीम् ॥ १४ ॥"	[]
36	Chapter - 36	15	"कृत्वा वै व्यक्तिभावं च प्रमाणैरुत्तमादिकैः ।  
यथाकालानुरूपैश्च वासुदेवोपलालात्मना ॥ १५ ॥"	[]
36	Chapter - 36	16	"अतस्तद्रूपनाम्ना वै ख्याता क्षेत्रेश्वरा भुवि ।  
प्रख्यातास्तुल्यनाम्नान्ये देवस्सायतनस्तु वै ॥ १६ ॥"	[]
36	Chapter - 36	17	"एवं क्षेत्रेश्वरैः क्षेत्रैः कर्मभूमिरधिष्ठिता ।  
क्षेत्रैरमूर्तैश्चिद्रूपैर्मूर्तैः क्षेत्राधिपैस्तथा ॥ १७ ॥"	[]
36	Chapter - 36	18	"इति यक्त्यावतीर्णा ये क्षेत्राणां क्षेत्रनायकाः ।  
तेऽपि कालान्तरेणैव स्वयं दोषं शिलामयम् ॥ १८ ॥"	[]
36	Chapter - 36	19	"बुध्वान्तर्धानमायान्ति देशभङ्गादिकैर्द्विज ।  
विचारैः प्रचुरैः र्भूयः प्राग्वद्व्यक्तिं व्रजन्ति च ॥ १९ ॥"	[]
36	Chapter - 36	20	"स्वयं चावानियात्तु स्वसामर्थ्येन चोदयेत् ।  
कुर्वन्नम्बुनिधेर्यद्वदम्बुदौघनचोदितम् ॥ २० ॥"	[]
36	Chapter - 36	21	"इति मत्प्रतिनाम्? स्वप्ने प्रत्यक्षतोऽपिवा ।  
वदन्ति योगक्षेमाद्यं स्वयं वा तन्मयात्मनाम् (क्, ख्: तन्मयात्मना) ॥ २१ ॥"	[]
36	Chapter - 36	22	"तत्तत्वेतिभक्तानां सस्यार्थं सर्वदा भवेत् ।  
असत्यार्थमतोऽन्येषां किन्तु पुष्करसम्भव ॥ २२ ॥"	[]
36	Chapter - 36	23	"इत्युत्कर्षं भवेषामस्तित्वेन समन्वितम् ।  
निरासार्थमभक्तानां नास्तिकत्वेन वासना ॥ २३ ॥"	[]
36	Chapter - 36	24	"तुष्टये ह्यास्तिकानां तु तीर्थादीनां हि सिद्धये ।  
क्षेत्रेशा वासुदेवाषुदेवास्ते स्थिताश्चोपलकुक्षिषु ॥ २४ ॥"	[]
36	Chapter - 36	25	"क्वचित्साक्षात्तथा चक्रशङ्खपद्मगदात्मना ।  
विशेषेण त्रिकूटे तु पिस्रैरैवतके तु वै ॥ २५ ॥"	[]
36	Chapter - 36	26	"सालग्रामे तु सह्यद्रौ तथा विष्णुपदे द्विज ।  
व्यावर्ते चैव कृष्णाश्वे कुक्षौ तु हिमाचले ॥ २६ ॥"	[]
36	Chapter - 36	27	"महेन्द्रे मलये विन्ध्यरियात्रेऽथवार्वुदे (ग्, घ्: थवानदे (म्बुदे)) ।  
सत्यव्रतस्थे हस्त्यद्रौ विकटे (ग्, घ्: सङ्कटे) पर्वतोत्तमे ॥ २७ ॥"	[]
36	Chapter - 36	28	"सिंहाचले मन क्षेत्रे पुण्ये वा सुमनोहरे ।  
एवं कमलसम्भूत वासुदेवैरधिष्ठिते ॥ २८ ॥"	[]
36	Chapter - 36	29	"अनेकाकृति भेदैत्यैरेनैकेन केनचित् ।?  
अयत्नात् कल्पिते क्षेत्रे स्वबुध्या तु व्रजन्ति ये ॥ २९ ॥"	[]
36	Chapter - 36	30	"अश्रित्य क्षेत्रनाथं तु विषयन्ते च तत्र ये ।  
अवसाने तु वा चान्ये धरांशे मध्यमे तु वा ॥ ३० ॥"	[]
36	Chapter - 36	31	"आद्ये वा देवदृष्टे ते प्रयान्ति क्रमेण तु ।  
तस्य वै क्षेत्रनाथस्य सतत्त्वक्ष्मागतस्य च ॥ ३१ ॥"	[]
36	Chapter - 36	32	"तत्सालोक्यं तु सामीप्यं सायुज्यमलेक्षणा ।  
परिग्रहविहीनं च विवेकरहितं जनम् ॥ ३२ ॥"	[]
36	Chapter - 36	33	"शरणागतभूतं तु अपि चेन्नास्तिकं पुरा ।  
तथान्तिकं श्रद्धधानं निश्चेष्टं चापि पौष्कर ॥ ३३ ॥"	[]
36	Chapter - 36	34	"विसञ्ज्ञं बन्धुभिर्नीतं कारुण्यात्कमलोद्भव ।  
त्राहीत्युक्त्वा जगन्नाथं क्षिप्त्वा स्त्रीबालपूर्वकैः ॥ ३४ ।"	[]
36	Chapter - 36	35	"ज्ञात्वा विमुक्तदेहं तं सह पुर्यष्टकेन तु ।  
महता तूर्यघोषेण कृत्वा रथवरे तु वै ॥ ३५ ॥"	[]
36	Chapter - 36	36	"जित्वान्तकभटात्रौद्रान् बलात् क्षेत्रेशङ्किङ्करैः ।  
नृसिंहकपिलक्रोडवामनाश्वशिरोमुखैः ॥ ३६ ॥"	[]
36	Chapter - 36	37	"ससौम्यवदनैः पद्मशचक्रगदाधरैः ।  
सीरनन्दकधृग्वज्रपाशाङ्कुशधनुर्धरैः ॥ ३७ ॥"	[]
36	Chapter - 36	38	"मुसलादितथादण्डहस्तैश्च गरुडाननैः ।  
आनीय क्षेत्रनाथस्य अभिगच्छापयन्ति च ॥ ३८ ॥"	[]
36	Chapter - 36	39	"देव क्षेत्रे त्वदीयेऽस्य विमुक्तं (ग्, घ्: वियुक्तं पाञ्च) पाञ्चभौतिकम् ।  
शरीरमद्यानाथस्य कुरु श्वशद्यथोचितम् ॥ ३९ ॥"	[]
36	Chapter - 36	40	"क्षेत्रनाथस्तु * * * समाकर्ण्य (क्, ख्: कर्म सत्कर्मिणाम्) गणेरितम् ।  
करुणानुगतेनैव तं निरीक्ष्य तु चक्षुषा ॥ ४० ॥"	[]
36	Chapter - 36	41	"कृतं विनपापं तु तस्मिन्नायतने पुरा ।  
सम्प्राप्तस्य स्वके स्थाने दोषशेषं हि वै पुनः ॥ ४१ ॥"	[]
36	Chapter - 36	42	"संसर्गोलयं नीत्वा क्रमात् कालान्तरेण वै ।  
द्वाभ्यामेवं प्रकारेण यदन्यच्चात्मसात् कृतम् ॥ ४२ ॥"	[]
36	Chapter - 36	43	"तपं लिङ्गवशात्कृष्य स्वशक्त्या च स्वविग्रहात् ।  
संस्कारयोग्यतां ज्ञात्वा सम्यज्ज्ञानाप्तये तु वै ॥ ४३ ॥"	[]
36	Chapter - 36	44	"ददाति कर्मभूमौ तु जन्म ((पाठान्तरम्) तदादिकर्म) सत्कर्मिणा कुले ।  
स्वक्षेत्रे वा परक्षेत्रे तत्र सालोकनं हि यत् ॥ ४४ ॥"	[]
36	Chapter - 36	45	"कालात् प्राप्ताधिकारश्च कृत्वा व्याप्तां समासतः ।  
यथोचितमनुष्ठानं त्रयोदशवि(धं)शुभम् ॥ ४५ ॥"	[]
36	Chapter - 36	46	"तत्तेन कृतकृत्यं स्यात्तदर्धेन तु चापरम् ।  
तृतीयमब्जसम्भूत सम्यज्ज्ञानेन युज्यते ॥ ४६ ॥"	[]
36	Chapter - 36	47	"ज्ञा(न)तमात्रं हि वै कालादिन्द्रियव्यक्तिलक्ष(णं)णात् ।  
स्वयं चीर्णव्रतं प्राग्वत्तत्क्षेत्रे बुद्धिपूर्वकम् ॥ ४७ ॥"	[]
36	Chapter - 36	48	"तीव्रभावेन वै पश्चाद्देहत्यागं व्रतादिना ।  
कुर्यात् क्षेत्राधिपस्याग्रे तद्वत्तं गतकल्मसम् ॥ ४८ ॥"	[]
36	Chapter - 36	49	"पृथग्देहारणीं कृत्वा ज्ञानं यद(धर्म)मलं शुभम् ।  
स (क्, ख्: सनस्योपद्विजत्वाज्यम्; ग्, घ्: सनस्योपदिशन्याज्यम्) तस्योपदिशत्याज्यं ? तत्रै(वे)व कमलेक्षण ॥ ४९ ॥"	[]
36	Chapter - 36	50	"यत्प्राप्य परमं धाम वासुदेवाख्यमेव च ।  
योगिनां तीर्थपुण्यानि ब्रह्मन्नापतितानि च ॥ ५० ॥"	[]
36	Chapter - 36	51	"सदाप्याधारभावेन ह्यङ्गभावं व्रजन्ति वै ।  
योगोत्कृष्टप्रकृष्टं च प्राप्यन्ति ज्ञानिनोऽपि ये ॥ ५१ ॥"	[]
36	Chapter - 36	52	"शश्वज्ज्ञानसमाकीर्णं निर्विघ्नेनाप्नुवन्ति च ।  
एवमाया(य)तनात् ब्रह्मन्नुपायं भविनां परम् ॥ ५२ ॥"	[]
36	Chapter - 36	53	"यतोऽस्ति च अतो हेतोस्सेवनीयं सदैव हि ।  
अभिजातस्य बीजस्य यथामलमरीचयः ॥ ५३ ॥"	[]
36	Chapter - 36	54	"प्रारोहजननीं शक्तिं सन्तापात् (क्, ख्: सन्तापं ध्वंस) ध्वंसयन्ति च ।  
विना स्वरूपहानेर्वै साम्प्रतं ह्येवमेव हि ॥ ५४ ॥"	[]
36	Chapter - 36	55	"स्वप्रभावेन वै सम्यक् स्वशक्तिकिरणैश्शुभैः ।  
प्रक्षीणकल्मषं कृत्वा क्षेत्रे वै क्षेत्रवासिनाम् ॥ ५५ ॥"	[]
36	Chapter - 36	56	"कुर्वन्त्यनुग्रहं पश्चात् क्षीणपापस्य तस्य च ।  
मृदम्बुहुतभुग्वात्पातैर्गगनलक्षणैः ॥ ५६ ॥"	[]
36	Chapter - 36	57	"प्रसिद्धयन्त्रितं ह्यत्र असिद्धं तद्वयं शृणु ।  
यदन्नाम्बुपरित्यागाद्वातं तद्वातसञ्ज्ञितम् (ग्, घ्: तद्वाद) ॥ ५७ ॥"	[]
36	Chapter - 36	58	"सर्वद्वारोपरोधेन यत्त(त्न)न्नाभासमुत्तमम् ।  
कालं वा देहपातीयं सम्यज्ज्ञात्वात्र पौष्कर ॥ ५८ ॥"	[]
36	Chapter - 36	59	"कार्यमासादने य(त्नं)त्नात्तत्र भक्त्या शुभैषिणा ।  
यदि न प्राप्नुयाच्चैव जन्माभ्यासादवाप्यते ॥ ५९ ॥"	[]
36	Chapter - 36	60	"विलयं यान्ति वै येन त्राहि जन्मनि जन्मनि ।  
कृतबुद्धेर्मनुष्यस्य पापेनातिबलीयसा ॥ ६० ॥"	[]
36	Chapter - 36	61	"न सञ्जाता च तत्प्राप्तिर्यद्यप्यब्जसमुद्भव ।  
न शासनस्य घोरस्य आन्तकस्य स भाजनम् ॥ ६१ ॥"	[]
36	Chapter - 36	62	"मान्यो यमभटानां च यज्ञयाजी यथा पुमान् ।  
आस्तां हि तावन्मनुजा नियमाद्यैरलङ्कृताः ॥ ६२ ॥"	[]
36	Chapter - 36	63	"भावभक्तिविशेषाढ्या (क्, ग्: विशेषाभ्याम्) प्राणिनोऽन्येपि तत्र ये ।  
प्राक्संस्कारवशाज्जातास्तेऽपि जात्यन्तरं पुनः ॥ ६३ ॥"	[]
36	Chapter - 36	64	"नाप्नुवन्ति (ग्, घ्: प्राप्नुवन्ति) विप्र सद्विवेकविवर्जिताः ।  
मम भक्तायतानां ? च इत्येषां यस्तु विन्दति ॥ ६४ ॥"	[]
36	Chapter - 36	65	"नृणां मध्ये स धन्यो वै दुष्कृतैर्नातिबाध्यते ।  
कर्मणां वै ह्यभुक्तानां न नाशोस्ति च यद्यपि ॥ ६५ ॥"	[]
36	Chapter - 36	66	"तानवं क्षेत्रमाहात्म्यप्रभावात्सम्प्रयान्ति ते ।  
जन्माभ्यासवशेनैव नूनं कर्मक्षयो भवेत् ॥ ६६ ॥"	[]
36	Chapter - 36	67	"सामर्थ्यात् क्षेत्रनाथानां सक्षेत्राणां महामते ।  
क्षेत्रेष्वेवम्प्रकारेषु दानं यच्छन्ति येऽर्थिनाम् ॥ ६७ ॥"	[]
36	Chapter - 36	68	"विभोराराधनार्थं तु भक्त्या कुर्वन्ति वा तपः ।  
साधयन्ति च मन्त्रेशं तर्पयन्ति तिलादिभिः ॥ ६८ ॥"	[]
36	Chapter - 36	69	"ये यजन्ति मखैर्देवान् लभन्ते तेऽखिलं फलम् ।  
द्वादशाक्षरपूर्वैस्तु प्रसिद्धैः कमलोद्भव ॥ ६९ ॥"	[]
36	Chapter - 36	70	"मन्त्रैर्जितन्तामन्त्रान्तैः प्राप्तैर्वाथ गुरोर्मुखात् ।  
स्वकेन मन्त्रमुख्येन विधिवत्परमेश्वरम् ॥ ७० ॥"	[]
36	Chapter - 36	71	"आराध्यायतनस्थम् च यत्किञ्चिदधिकारिणाम् ।  
द्विजेन्द्रद्विजमुख्यानां (क्, ख्: मुख्यानां * * * * यतेपाञ्चिरकालिनाम्) दीयते पाञ्चकालिनाम् ॥ ७१ ॥"	[]
36	Chapter - 36	72	"तदक्षयं परिज्ञेयं भवभोगाभिलाषिणाम् ।  
दानान्निवृत्तरागाणां तत्पुनर्मोक्षसिद्धये ॥ ७२ ॥"	[]
36	Chapter - 36	73	"ग्राममण्डलदेशान्तर्मदायतनवासिनाम् ।  
दत्तमात्मसमैः ? भूत्यै ((पाठान्तरम्) मृत्यैः पशुभिः) बहुभिर्नीरुजोऽश्नुते ॥ ७३ ॥"	[]
36	Chapter - 36	74	"सम्पुर्णासु स्वशक्त्या च नित्यं जन्मनि जन्मनि ।  
अनन्तभविकं विद्धि तद्दिव्यायतनात्पुनः ॥ ७४ ॥"	[]
36	Chapter - 36	75	"विज्ञेयं लक्षभविकं तत्सिद्धायतनात्तु वै ।  
सहस्रभविकं विप्र विप्रप्रवरकल्पितात् ॥ ७५ ॥"	[]
36	Chapter - 36	76	"दशाङ्गभविकं तद्वै कृतं यत्क्षत्रियेन तु ।  
तदर्धभविकं विद्धि सद्वैश्यपरिकल्पितात् ॥ ७६ ॥"	[]
36	Chapter - 36	77	"सच्छूद्रकल्पिते विप्र दत्तमायतने तु वै ।  
द्विषट्कभवनं तद्वै दानं ज्ञेयं द्विजोत्तम ॥ ७७ ॥"	[]
36	Chapter - 36	78	"अनन्यशरणेभ्यो वै वर्णेभ्यः परिकल्पिते ।  
द्विजेन्द्रायतने दत्तं फलं तत्पुनरेव हि ? ॥ ७८ ॥"	[]
36	Chapter - 36	79	"व्यामिश्रयाजिभिर्वणैर्निर्मितायतनास्तु ये ।  
पूर्वोक्तेभ्यः प्रयच्छन्ति तदर्धभविकं क्रमात् ॥ ७९ ॥"	[]
36	Chapter - 36	80	"फलकामफलेप्सूनां निष्कामानां हि पौष्कर ।  
सर्वायतनगो देवस्सर्वमूर्तिष्ववस्थितः ॥ ८० ॥"	[]
36	Chapter - 36	81	"मूर्त्यन्तरगतश्चापि प्रादुर्भावगतस्त्वपि ।  
प्रादुर्भावान्त(रा)या ? वृत्तिं ददाति परमं पदम् ॥ ८१ ॥"	[]
36	Chapter - 36	82	"आचर्तव्यमतस्तस्माद्यत्नेन महता (ग्, घ्: महताब्जज) द्विज ।  
मन्त्राराधनपूर्वेण कर्मणा (ग्, घ्: चन्मलक्षणम्) चि * * * * लक्षयम् ॥ ८२ ॥"	[]
36	Chapter - 36	83	"तस्माद्विमुक्तरागाणां नृणामच्युतयाजिनाम् ।  
व्यज्यते स्वात्मवृत्तिस्थं वासुदेवमजं विभुम् ॥ ८३ ॥"	[]
36	Chapter - 36	84	"तदधिष्ठितचित्तस्तु यत्र यत्र यजेद्बहिः ।  
तत्र तत्र तदा तेषां व्यज्यते ब्रह्म शाश्वतम् ॥ ८४ ॥"	[]
36	Chapter - 36	85	"देवायतनजातानां नृणामशुभकारिणम् ।  
मृतानां तत्र बाह्य (न्य)त्र ज्ञातुमिच्छाम्यहं गतिम् ॥ ८५ ॥"	[]
36	Chapter - 36	86	"केन चित् प्राक्तनेनैव कर्मणाऽविमलेन च ।  
आचरन्त्यब्जसम्भूत मतेर्वै दुष्कृतं पुनः ॥ ८६ ॥"	[]
36	Chapter - 36	87	"ज्ञात्वापि ज्ञेत्रमाहात्म्यं विवशात्तु बलात्तु वै ।  
तं म्रियन्तं च तत्रास्थे ? जन्माभ्यासवशेन तु ॥ ८७ ॥"	[]
36	Chapter - 36	88	"क्षेत्रे च पापतस्तेषां सङ्क्षिपत्यन्तकस्य च ।  
शश्वद्दुष्कृतशान्त्यर्थं उपायैर्नातिशासनैः (श्वतैः) ॥ ८८ ॥"	[]
36	Chapter - 36	89	"त्वमेव तेषां कुरु(षे)षु ? भुक्तशेषं हि कल्मषम् ।  
शमयत्यचिरादेव आचरन्ति यथाशुभम् ॥ ८९ ॥"	[]
36	Chapter - 36	90	"भूयः प्राप्तेन देहे(भोगे)न अस्मदीये परिग्रहे ।  
स चाज्ञां शिरसा तां वै कृत्वा चैव महामते ॥ ९० ॥"	[]
36	Chapter - 36	91	"करुणानुगतेनैव संशोधयति चेतसा ।  
एवं विगतदोषास्ते यान्ति कालान्तरेण तु ॥ ९१ ॥"	[]
36	Chapter - 36	92	"सा * * * * (ग्, घ्: सामीथीनां च सालोक्यात् (पा) सन्ती ? धीताम्) च साकल्यात् सत्सम्पर्काद्विशेषतः ।  
प्रक्षीणकल्मषा नूनं पुनरायान्ति वैदिकीम् ॥ ९२ ॥"	[]
36	Chapter - 36	93	"तदुत्पन्ना विपद्यन्ति पापिष्ठा ह्यत्र वै यदि ।  
कागतिर्भवते तेषां नराणामतिपापिनाम् ॥ ९३ ॥"	[]
36	Chapter - 36	94	"शोधयत्यन्तकस्तेषां दुष्कृतिं नातिशासनैः ।  
गतदोषास्समायान्ति मानुष्यं हि तदा पुनः ॥ ९४ ॥"	[]
