chapter	chapter_title	verse_number	original_text	commentaries
27	Chapter - 27	526	"हृन्मन्त्रेण द्वितीयस्य मूलमन्त्रेण वै ततः ।  
आचर्तव्यं चतुर्थस्य हस्तन्यासादिकं हि यत् ॥ ५३० ॥"	[]
27	Chapter - 27	527	"षण्णामथ (क्: षण्णामथ * * * कृत्वाभगवदर्चनम् अत्र त्रुटिस्थाने अर्धद्वयं लुप्तम्; ख्: षण्णामथ नवानां तु भगवदर्चनम्) शिखामन्त्रं खा द्यखातपविन्यसेत् ।  
ततोग्निभवनान्तं तु कृत्वा भगवदर्श्चनम् ॥ ५३१ ॥"	[]
27	Chapter - 27	528	"पूजयेत् सविशेषं तु कृत्वैवं हि यथोदितम् ।  
अस्त्रन्यस्तं ततोऽस्त्रेण पूजनीयं द्विजोत्तम ॥ ५३२ ॥"	[]
27	Chapter - 27	529	"वर्मणा (क्, ख्: वर्मणा * * * मूर्तिं च) वर्ममूर्तिं च नामगोत्रद्वयं विना ।  
ततः स्वनाम्ना गोत्रेण (ग्, घ्: गोत्रेषु) कुर्यादन्येषु चार्चनम् ॥ ५३३ ॥"	[]
27	Chapter - 27	530	"स्वेन स्वेन तु मन्त्रेण तत्र प्रेतं द्विजं हि यत् ।  
नेत्रमन्त्रकृतन्यासं (ग्, घ्: स्वेन स्वेनक्रतुन्यासम्) तत्तेनैव समर्चयेत् ॥ ५३४ ॥"	[]
27	Chapter - 27	531	"तस्योपर्युपविष्टं तु संस्थितं पितृलक्षणम् (क्, ख्: पितृलक्षणात्) ।  
पूजने विहितं तस्य शिरोमन्त्रं स्वकं द्विज ॥ ५३५ ॥"	[]
27	Chapter - 27	532	"विप्र हृन्मन्त्रमभ्यर्च्य यत्तद्विधि पितामहम् ।  
प्रेतं तस्यार्चनं कुर्यान्नाम्ना गोत्रेण वै हृदा ॥ ५३६ ॥"	[]
27	Chapter - 27	533	"मूलमन्त्रकृतन्यासं (क्, ग्: मन्त्रे क्रतुन्यासम्) तद्विधि प्रपितामहम् ।  
माननीयं हि तेनैव नाम्ना गोत्रेण वै सह ॥ ५३७ ॥"	[]
27	Chapter - 27	534	"तेषां वै हृद्गतं ? विप्र पूजितानां च साम्प्रतम् ।  
प्रेतादिपितृकॢप्तस्य कार्या चान्तस्थयोजना (चान्तस्य इति पाठान्तरम्) ॥ ५३८ ॥"	[]
27	Chapter - 27	535	"यथा तत्पद्मसम्भूत मत्तस्समवधारय ।  
नैवेद्यनाशं क्रमशः प्राग्वदन्नरसात्मनाम् ॥ ५३९ ॥"	[]
27	Chapter - 27	536	"स्वयं (क्, ख्: स्वयं देवगणश्चिन्त्या) देवगणं चिन्त्यं समं ध्यायेद्धिया ततः ।  
अजहन् स्वाश्रयं भक्त्या पूर्णेन्द्वा ? (क्, ख्: भक्त्या पूर्वे द्वाहासतुल्यताम्) सकुल्यताम् ॥ ५४० ॥"	[]
27	Chapter - 27	537	"सामा ? (ग्, घ्: स्वातम्पैत्रे) पैत्रेऽन्नमात्रं तु नेत्रमन्त्रं विचिन्त्य च ।  
एवमेव शिरोमन्त्रमुपयातं धिया स्मरेत् ॥ ५४१ ॥"	[]
27	Chapter - 27	538	"सह लोचनशक्त्या तु पात्रे हृन्मन्त्रभाविते ।  
द्वे (क्, ख्: द्वेशक्तिनेत्रमध्वाख्ये) शक्ती नेत्रमूर्ध्वाख्ये समादायाथ हृन्मयीम् ॥ ५४२ ॥"	[]
27	Chapter - 27	539	"शक्तिं वै मूलमन्त्रीयैर्नैवेद्यान्तर्गतां स्मरेत् ।  
मन्त्रशक्तिच्छलेनैव सान्नेन प्रणवात्मना ॥ ५४३ ॥"	[]
27	Chapter - 27	540	"मन्त्रब्रह्मणि चैकत्वं कुर्याद्वा (ग्, घ्: कुर्यात् प्रेतस्य) तस्य पौष्कर ।  
प्रतिपाद्याथ वै स्मस्मिन् नीत्वा नैवेद्यभाजनम् ॥ ५४४ ॥"	[]
27	Chapter - 27	541	"द्विजानामुपविष्टानां भक्ष्यभोज्यादिकैस्सह ।  
गोक्षीरमात्रपर्यन्ते दद्यात्पाणौ ततोदकम् ? ॥ ५४५ ॥"	[]
27	Chapter - 27	542	"भोजने सम्प्रवृत्तानां यस्य यच्चोपयुज्यते ।  
पृष्ट्वा पृष्ट्वा च दद्याद्वै पितॄणां तृप्तये द्विज ॥ ५४६ ॥"	[]
27	Chapter - 27	543	"स्वाहान्तानां ततस्तेषां तत्र स्थानं समाचरेत् ।  
एकत्वं (क्, ख्: एक * * * शक्तीनाम्) त्विति शक्तीनां विधिनानेन पौष्कर ॥ ५४७ ॥"	[]
27	Chapter - 27	544	"तत्त्वशक्तिगुणोपेतं प्रदीप्तमिव भास्करम् ।  
साम्प्रतं (क्, ख्: सवृद्धं पूर्व; ग्, घ्: सुपृक्तं पूर्व) पूर्ववत्प्रेतं आहृत्य द्विद्विविग्रहात् ॥ ५४८ ॥"	[]
27	Chapter - 27	545	"रेच्य हृत्कमले मन्त्रतेजसा तेन तत्पुनः (ग्, घ्: यत्पुनः) ।  
कुर्याद्युक्ततरं चैव तस्मादाकृष्य (क्, ख्: दाहृत्य) वै हृदि ॥ ५४९ ॥"	[]
27	Chapter - 27	546	"पैतामहे विरेच्याथ हृत्पद्मोपरि वृद्धये (घ्: परि वर्धयेत्) ।  
तस्मादुद्धृत्य (क्, ख्: तस्मादु * * * वै) सन्तृप्तं हृदा कुर्याच्च वै हृदि ॥ ५५० ॥"	[]
27	Chapter - 27	547	"प्रपितामहहृत्पद्मगोचरौ विनिवेश्य च ।  
मन्त्रब्रह्मकलादीप्तं कृत्वा तत्रानयेत् हृदि ॥ ५५१ ॥"	[]
27	Chapter - 27	548	"विलाप्य (ग्, घ्: विलोप्य) प्रणवेनाथ शान्तभावनयात्मनि ।  
एवं (क्, ख्: एवं कृत्वान्नसन्तानम्) कृत्वानुसन्धानं ततः प्रभृति तस्य वै ॥ ५५२ ॥"	[]
27	Chapter - 27	549	"नान्येषां द्विजशार्दूल पितॄणां श्राद्धकाङ्क्षिणाम् ।  
प्रेतत्वसुपशान्ते वैः (क्, ख्: * * * जयन्तो जाग्रतस्य च) जन्तोर्जाग्रस्थितस्य च ॥ ५५४ ॥"	[]
27	Chapter - 27	550	"पितृत्वं (क्, ख्: पितृत्वं * * * ञ्चोत्तरे; ग्, घ्: पितृत्वं लब्ध सस्तव्यसंस्थितम्) लब्ध * * * संस्थितं चोत्तरोत्तरम् ।  
एवमुक्तं (क्, ख्: * * * कमलोद्भव) हि साङ्गेन मन्त्रेण कमलोद्भव ॥ ५५५ ॥"	[]
27	Chapter - 27	551	"और्ध्वदैहिकसञ्ज्ञं तु विधानं (ग्, घ्: विधानमविधानतः) भाविनामथ ।  
चतुर्भिश्चातुरात्मीयैर्मन्त्रैस्तद्विनिबोध मे ॥ ५५६ ॥"	[]
27	Chapter - 27	552	"श्रोत्राद्युपस्थपर्यन्तमिन्द्रियाणां द्विपञ्चकम् ।  
आपाद्य वासुदेयाख्यं मन्त्रेण दशभिर्दिनैः ॥ ५५७ ॥"	[]
27	Chapter - 27	553	"अस्मिन् व्यक्तिमतः कुर्यात् साङ्कर्षणेन पौष्कर ।  
बुद्धितत्त्वे तृतीयेन व्यञ्जयेन्मनसा सह ॥ ५५८ ॥"	[]
27	Chapter - 27	554	"क्ष्मान्तमाकाशतन्मात्रादनिरुद्धेन (क्, ख्: * * * निरुद्धेन) पौष्कर ।  
पूर्ववद्व्यञ्जनीयं च एवं संवत्सरे गते ॥ ५५९ ॥"	[]
27	Chapter - 27	555	"सपिण्डीकरणं कुर्यादनिरुद्धादितः क्रमात् ।  
चतुर्भिर्वासुदेवान्तैर्मन्त्रैर्मन्त्रविदां वर ॥ ५६० ॥"	[]
27	Chapter - 27	556	"एवमिच्छेन्नवात्मज्ञस्समूर्तिनवकेन यत् ।  
संविधानं (क्, ख्: साविधानु) द्विजश्रेष्ठ बान्धवानां शुभाप्तये ॥ ५६१ ॥"	[]
27	Chapter - 27	557	"तदिदानीं समासेन एकाग्रमवधारय ।  
श्रोत्रादीनामिन्द्रियाणां तृप्तये (क्, ख्: याणां * * * क्ष्माधरम्; ग्, घ्: क्ष्माधराम्) क्ष्माधरं स्मृतम् ॥ ५६२ ॥"	[]
27	Chapter - 27	558	"भूगादीनां ? (क्, ख्: भू * * * दिनाम्) नृसिंहं तु अस्मिन् शक्तौ खगासने ।  
व्यक्तये ब्रह्मतत्त्वं तु बुद्धे समनसां ? हितम् ॥ ५६३ ॥"	[]
27	Chapter - 27	559	"तन्मात्राणां सभूतानां मन्त्राणां (ग्, घ्: मन्त्रधारणयात्मकम् ?) धारणात्मकम् ।  
एवं तत्त्वकलायुक्तं जपं कृत्वा महामते ॥ ५६४ ॥"	[]
27	Chapter - 27	560	"पञ्चभिस्तु वराहाद्यैः ततस्संवत्सरे गते ।  
चतुर्भिरनिरुद्धाद्यैः पितृभावनमानयेत् ॥ ५६५ ॥"	[]
27	Chapter - 27	561	"पूर्वोक्तेन विधानेन ज्ञानध्यानान्वितेन च ।  
दिव्येनानश्वरेणैव कर्मणानेकसाधनम् (ग्, घ्: साधुना) ॥ ५६६ ॥"	[]
27	Chapter - 27	562	"संविधानं द्वितीयं तत्प्रोक्तं संसूचितं मया ।  
तन्मे स्फुटतरं कृस्वा गदतश्चावधारय ॥ ५६७ ॥"	[]
27	Chapter - 27	563	"सर्वं पूर्वोदितं कृत्वा विधानं साधने चरोः ।  
प्रज्वाल्य पावकं कुर्यात् प्राग्वत्संस्कारसंस्कृतम् ॥ ५६८ ॥"	[]
27	Chapter - 27	564	"ध्यात्वा तदन्तर्मन्त्रेशं समिद्भिस्तर्पयेत् (क्, ख्: समि * * *) क्रमात् ।  
तदग्रतो दक्षिणाग्रान् कुशानास्तीर्य पूर्ववत् ॥ ५६९ ॥"	[]
27	Chapter - 27	565	"सवासमासनं ध्यात्वा तदूर्ध्वे कमलासनम् ।  
युक्तमाद्यादिकैः (क्, ख्: युक्तमा * * * प्राग्वत्) प्राग्वद्विन्यसेदन्नगोलकम् ॥ ५७० ॥"	[]
27	Chapter - 27	566	"तस्मिन् पूर्वोदितं सर्वमापाद्य तदनन्तरम् ।  
प्रेतनाम्ना तदग्रेऽथ सतिलानुदकाञ्जलीन् ॥ ५७१ ॥"	[]
27	Chapter - 27	567	"दत्त्वाथ चोपसंहृत्य विनिक्षिप्य जलान्तरे ।  
कृत्वाथ सह मन्त्रेण आत्मसादसनं ? (ग्, घ्: आत्मसादादनम्) द्विज ॥ ५७२ ॥"	[]
27	Chapter - 27	568	"जलेऽखिलं समाहृत्य विनिक्षिप्यानलं विना ।  
दशाहमेवं (क्, ख्: * * * निष्पाद्य) निष्पाद्य प्राग्वदेकादशेऽहनि ॥ ५७३ ॥"	[]
27	Chapter - 27	569	"श्राद्धं कुर्याद्विधानज्ञः पिण्डदानपुरस्सरम् ।  
संवत्सरेऽथ निष्पन्ने पितृत्वापादनाय च ॥ ५७४ ॥"	[]
27	Chapter - 27	570	"ध्यानं समन्त्रं (ग्, घ्: समन्त्रं पूर्वोक्तं कञ्चदञ्चाधिकम्) पूर्वोक्तं * * * त्वाधिकं भवेत् ।  
भास्वज्ज्वलनसङ्काशं समर्थैकत्वमागतम् (क्, ख्: समयैकत्वमागतम्) ॥ ५७५ ॥"	[]
27	Chapter - 27	571	"तदध्यक्षत्वभूतं (क्, ख्: * * * भूतं यत्) यन्मन्त्रमध्यात्मलक्षणम् ।  
अधिभूतमथापन्नं पिण्डं (क्, ख्: पिण्डनि * * * मुखस्थितं यत्) निर्गत्य संस्मरेत् ॥ ५७६ ॥"	[]
27	Chapter - 27	572	"तदूर्ध्वदेशे (क्, ख्: * * * हव्यपारम् * * *) नभसि व्यापारं सन्निरीक्षयेत् ।  
एवमन्नात्पृथङ्नीते विप्रेते ? (ग्, घ्: विप्रेति कमलो) कमलोद्भव ॥ ५७७ ॥"	[]
27	Chapter - 27	573	"तन्मन्त्रेण च तत्पिण्डादधिभूतमयादथ ।  
समादायान्नमुष्टिं (क्, ख्: * * * व्यापकत्वेन साम्प्रतम्) च तत्र तत् खण्डितं च यत् ॥ ५७८ ॥"	[]
27	Chapter - 27	574	"स्मरेत्परिणतं सम्यक् व्यापकत्वेन साम्प्रतम् ।  
अथादिभूतं चाध्यात्ममधिदैवमथाब्जज ॥ ५७९ ॥"	[]
27	Chapter - 27	575	"तदन्नं पितृपिण्डे (क्, ख्: पिण्डे तु * * * नयेत्) तु तदूर्ध्वेऽथ स्थितं नयेत् ।  
एवमेकत्वमापन्ने प्रेते (क्, ख्: प्रेतचित्प्रतिना; ग्, घ्: प्रेते चित्प्रतिरासह) चित्प्रतिना सह ॥ ५८० ॥"	[]
27	Chapter - 27	576	"प्रेतपिण्डव दब्जोत्थ (क्, ख्: दब्जोत्थ * * * चाखिलम्) वाचर्तव्यं हि चाखिलम् ।  
व्यापारमथ तस्याथ (ग्, घ्: मथ तस्माद्वै तस्मात्) तस्मात्पैतामहे ततः ॥ ५८१ ॥"	[]
27	Chapter - 27	577	"तस्मात्तदपि * * * * तत्प्राग्वत्परतां (क्: * * * तत्प्राग्वत्परताम्; ख्: तस्मात्तदवधूर्ध्वस्थम्; ग्, घ्: तस्मात्तदपि मूर्ध्वस्थे ?) नयेत् ।  
यथोक्तेऽस्मिन्द्विजश्रेष्ठ प्राजापत्ये तु कर्मणि ॥ ५८२ ॥"	[]
27	Chapter - 27	578	"आदे (ग्, घ्: आदेक्षेकादशापादने दिनम्) कादशाद्यावत्पितृत्वापादने दिनम् ।  
तावत्पूर्वोदितं शेसं यत्तत्पूर्वं समाचरेत् ॥ ५८३ ॥"	[]
27	Chapter - 27	579	"किन्तु भोजनभूमौ तु द्विजप्तैरासनस्थितैः ।  
वचनीयं हि चाक्षय्यं तिलमिश्रेण वारिणा ॥ ५८४ ॥"	[]
27	Chapter - 27	580	"एतावतास्य तात्पर्यं यथावत्सम्प्रकाशितम् ।  
और्ध्वदैहिकसञ्ज्ञस्य व्या * * * सात्त्विकम् (ग्, घ्: सञ्ज्ञस्य * * * घाचस्य सचात्विकम्) ॥ ५८५ ॥"	[]
27	Chapter - 27	581	"आसृष्टे सति रागौ च ? यथा (क्, ख्: यथा स्मरति वै) स्फूरति वै हृदि ।  
प्रत्ययावयवौ चैव * * * पौष्कर (ग्: प्रत्ययावयते चैव वनिद्वावाअपि) ॥ ५८६ ॥"	[]
27	Chapter - 27	582	"बल्यर्थं विहितं तेषा मन्नं (क्, ख्: मग्नं पिण्डे तु) पिण्डं तु सोदकम् ।  
प्रेतक्रियाविधौ (ग्, घ्: प्रेतक्रिया यथा) चैव (क्, ख्: चैव स्वयं कालम्) स्वं स्वं काल कुलोचितं ॥ ५८७ ॥"	[]
27	Chapter - 27	583	"चातुर्माननिषेधं च विहितं सूतकादिके ।  
प्रतिषेधं गृहीतुर्वै आभूतादब्जसम्भव ॥ ५८८ ॥"	[]
27	Chapter - 27	584	"द्विजेन्द्राणां तु (क्, ख्: द्विजेन्द्राणां स * * * चातुरात्म्यैव) सान्येषां चातुरात्म्यैकयाजिनाम् ।  
आराध्यानां प्रभवाच्च नास्तीति द्विजसत्तम ॥ ५८९ ॥"	[]
27	Chapter - 27	585	"अत एवाधिकारं तु मृतके सूतके तु वा ।  
प्रतिग्रहे प्रदाने च तत्कालं सङ्करं विना ॥ ५९० ॥"	[]
27	Chapter - 27	586	"सहजा प्रतिपत्तिर्वै इत्येषामरयाजिनाम् ।  
भगवद्याजिनां (क्, ख्: द्याजिनश्चैव) चैव निस्सन्दिग्धा ? परस्परम् ॥ ५९१ ॥"	[]
27	Chapter - 27	587	"मार्गमिच्छति (ग्, घ्: मामामिच्छति यस्यैव) यस्त्वेवमनुसर्तुं हि चाच्युतम् ।  
आशौचं समतीतं चेत्ततः कुर्याद्दशाहिकम् ॥ ५९२ ॥"	[]
27	Chapter - 27	588	"इत्युक्तमब्जसम्भूत (क्, ख्: इत्युक्त * * * स्थितम्) सर ? * * * * * * * * यथा स्थितम् ।  
सम्प्रदानादिकं शश्वत् श्राद्धावरणमुत्तमम् ॥ ५९३ ॥"	[]
27	Chapter - 27	589	"विध्यन्तरमथो भूयः प्रसङ्गादवधारय ।  
स्वर्गापवर्गफलदं भक्तानां भावितात्मनाम् ॥ ५९४ ॥"	[]
27	Chapter - 27	590	"व्यवहारपदस्थं यद्विच्छिन्ना शस्त्र ? (ग्, घ्: शास्तु बुद्धिभिः) बन्धुभिः ।  
स्वयमिच्छति (ग्, घ्: स्वयमिष्टमिवै कस्तु) वैकस्तु द्वादशाहाद्विजाखिलम् ॥ ५९५ ॥"	[]
27	Chapter - 27	591	"तदिदानीं समासेन यथावत्कथयाम्यहम् ।  
पुरा सम्भूतसम्भारः सुसहायैस्समावृतः (ग्, घ्: समावृत्तैः) ॥ ५९६ ॥"	[]
27	Chapter - 27	592	"मनःप्रसादजनकमेकं वा बहवो (ग्, घ्: विभवाद्विज) द्विजाः ।  
पुरस्कृत्य दिने शुभ्रे पितृपक्षात्तु वै पुरा ॥ ५९७ ॥"	[]
27	Chapter - 27	593	"प्रातृट्काले तु वान्यत्र शरत्काले तु माधवे ।  
यायादायतनं विष्णोः पुष्पधूपजनाकुलम् (क्: पुष्पजना; ख्: पुष्पभ्रमजना) ॥ ५९८ ॥"	[]
27	Chapter - 27	594	"कूलं नदनदीनां वा सान्वाद्यं सोदकं गिरेः ।  
निरातङ्कमसन्कीर्णं (क्, ख्, ग्, घ्: निरातङ्कसमं कीर्ण्य श्वपाकरवरादिकैः) श्वपाकशबरादिकैः ॥ ५९९ ॥"	[]
27	Chapter - 27	595	"तमासाद्य तपः कुर्याद्यागं च विधिपूर्वकम् ।  
गणे (क्, ख्: गणेन नाग) च नागस्थाने च भूतानां च वनस्पतेः ॥ ६०० ॥"	[]
27	Chapter - 27	596	"क्षेत्रवासिमुखेनैव यथाशक्त्या सदक्षिणाम् ।  
अपरेऽहनि वै कुर्यात्स्वमन्त्राराधनं तु वै ॥ ६०१ ॥"	[]
27	Chapter - 27	597	"विभोः (क्, ख्: विभोः * * * बीजान्वितस्य च) प्रणमतेध्यक्षं ? स्वचिद्बीजान्वितस्य च ।  
व्यक्ताव्यक्ता * * * * सञ्ज्ञस्य (क्, ख्: * * * मिन्द्रिय * * *) पिण्डमिन्द्रिय * * * * ॥ ६०३ ॥"	[]
27	Chapter - 27	598	"स्थापयामि सतत्त्वांशैस्सन्धयित्वा यथाविधि ।  
भेदरूपमभिन्नं (क्, ख्: मभिन्नं च कृपयात्माम् * * *) च * * * * यात्मांशुचयस्य च ॥ ६०४ ॥"	[]
