chapter	chapter_title	verse_number	original_text	commentaries
1	Chapter - 1	1	"यदा तीर्णव्रतस्तिष्ठेद् गुरोरग्रे (चीर्ण इति साधु) हितैषिणः ।  
तदा चाज्ञापयेच्छिष्यं सम्प्राप्तं कमलोद्भव ॥ १ ॥"	[]
1	Chapter - 1	2	"तत्तु (ख्: कर्तुम्) प्रदापयेत् काले पात्रे गुणगणान्विते ।  
यत्तदाज्ञापयेत् (क्: यस्त) तं वै गच्छ पुत्र धनं यतः ॥ २ ॥"	[]
1	Chapter - 1	3	"यागोपकरणार्थं तु येन शान्तिमवाप्स्यसि ।  
यथालब्धं तु तत् पश्चाद्गुरवे विनिवेद्य च ॥ ३ ॥"	[]
1	Chapter - 1	4	"त्वत्प्रसादेन भगवन्निदं प्राप्तं गृहाण मे ।  
दयां कुरु त्वनाथस्य (ख्: कुरुष्वानाथस्य) निमग्नस्य भवार्णवे ॥ ४ ॥"	[]
1	Chapter - 1	5	"एवमादि यदा भूयात् (ख्: तथा ब्रूयात्) करुणं वाक्यसञ्चयम् ।  
प्रवर्तेत तदर्थं तु गुरुर्मण्डलपूजने ॥ ५ ॥"	[]
1	Chapter - 1	6	"सूत्रयित्वा विधानेन पूरयित्वा रजैश्शुभैः (क्, ग्: रजश्शुभैः) ।  
लिखित्वा कुङ्कुमाद्यैर्वा चालिख्य (क्, ग्: वालिख्य) घटिकादिकैः (ख्: -कादिभिः) ॥ ६ ॥"	[]
1	Chapter - 1	7	"भूमौ हेमशलाकाद्यैर्वित्ताभावात् प्रयत्नतः ।  
पूजयेत् फलपुष्पाद्यैरारण्यैर्नित्यसम्भवैः (ख्: -नीरसम्भवैः) ॥ ७ ॥"	[]
1	Chapter - 1	8	"पूजितं दर्शयेत् तस्य तं तु विद्धि चतुर्विधम् ।  
आद्यम्पद्मोदराख्यं (ख्: पद्मोद्भवाख्यम्) तु न (क्, ख्: तत्वसङ्ख्योप) तु सङ्ख्योपलक्षितम् ॥ ८ ॥"	[]
1	Chapter - 1	9	"अनेककजगर्भं तु द्वितीयं परिकीर्तितम् ।  
तदनेकप्रकारं च चक्राब्जं स्यात् तृतीयकम् ॥ ९ ॥"	[]
1	Chapter - 1	10	"यस्य भेदोऽप्यनेकश्च (क्: भेदोप्यनेकाश्च; ग्: भेदाप्यनेकाश्च) स स्वल्वद्याब्जसम्भव ।  
मिश्रचक्राभिधानं तु मण्डलं बहु भेदयुक् (ख्: - भेदधृक्) ॥ १० ॥"	[]
1	Chapter - 1	11	"तच्चतुथं समाख्यातं यत्र रुद्ध्वा (ख्: रुद्धो) विमुच्यते ।  
महाख्यं नवनाभं तु बिम्बभेदेन यत् स्थितम् (ख्: स्मृतम्) ॥ ११ ॥"	[]
1	Chapter - 1	12	"दृष्टेन पूजितेनाथ तथाऽग्नौ कल्पितेन च ।  
मोक्षो येन भवत्याशु भक्तानां केवलेन च ॥ १२ ॥"	[]
1	Chapter - 1	13	"भेदयुक्तेन कालेन दृष्टेनेष्टेन वै क्रमात् ।  
द्वादश्यां प्रतिपक्षं तु वत्सरान्ते ततो द्विजम् ॥ १३ ॥"	[]
1	Chapter - 1	14	"समयी स भवेद्भक्तः पुत्रकश्चापरेण तु ।  
दृष्टेन पूजितेनापि ह्यनुध्यातेन वै हृदि ॥ १४ ॥"	[]
1	Chapter - 1	15	"तथाविधेन कालेन योग्यता तस्य जायते ।  
किञ्चारम्भेऽथ निष्पत्तौ पूजनीयं च भक्तितः ॥ १५ ॥"	[]
1	Chapter - 1	16	"पुत्रकत्वं यदा प्राप्तो जन्तुः प्रक्षीणकल्मषः ।  
तदागसि ? द्वयं तस्य प्रवर्तन्ते खिलान्यपि ? ॥ १७ ॥"	[]
1	Chapter - 1	17	"तदाऽसौ साधकत्वेन योक्तव्यो गुरुणा तथा ।  
तृतीयमण्डले चेष्ट्वा तत्र तं च प्रवेशयेत् ॥ १८ ॥"	[]
1	Chapter - 1	18	"पूज्यं तं बहुभिर्भेदैर्ध्यात्वा पूजय गोचरे ।  
पञ्चवासरहीनेन पक्षाणां त्रितयेन च ॥ १९ ॥"	[]
1	Chapter - 1	19	"एकैकं पूजयेच्चक्रं यावदब्जं प्रपूजयेत् ।  
तत्फलानि प्रवर्तन्ते क्रमशस्तस्य वै द्विज ॥ २० ॥"	[]
1	Chapter - 1	20	"गुरुणा साधकस्यातो दर्शनीयं प्रयत्नतः ।  
चतुर्थं तु महायागो (क्: महायोगो) येनाचार्यत्वमाप्नुयात् ॥ २१ ॥"	[]
1	Chapter - 1	21	"तमाद्योक्तं तु वै कालमिष्ट्वा (ख्: कालमिष्टमवाक्येन) वाक्येन चिन्तयेत् ।  
द्विज शेषदिनानां तु ह्येकैकं तु समापयेत् ॥ २२ ॥"	[]
1	Chapter - 1	22	"संवत्सरचतुष्कं तु यस्तु यागेन संयजेत् ।  
स संसारार्णवाद्ब्रह्मन् पारं प्राप्नोति दुस्तरात् ॥ २३ ॥"	[]
1	Chapter - 1	23	"यद्येकं तु महायागं नवनाभं समुद्यजेत् ।  
अस्मिन् संसारकान्तारे ज्ञानदीपास्त्वमी कृताः ॥ २४ ॥"	[]
1	Chapter - 1	24	"भक्तानां विविधा यागास्संयतानां सदैव हि ।  
नित्यं विप्रास्तिकानां च श्रद्धा संयमसेविनाम् (क्, ग्: संयमि) ॥ २५ ॥"	[]
1	Chapter - 1	25	"भवार्णवो ह्यलङ्ध्यस्तु विना स्याद्यागतोऽन्यकैः ।  
यागपोतं समारोप्य ज्ञेयं पाराभिलक्षणम् ॥ २६ ॥"	[]
1	Chapter - 1	26	"प्रोत्तारयति वै सम्यगुपकारेण वै विना ।  
कृपया परयाऽविष्टो यो विद्वान् स गुरुस्स्मृतः ॥ २७ ॥"	[]
1	Chapter - 1	27	"ज्ञात्वा भक्तमनाथं च निमग्नं शोकसागरे ।  
उद्धरेद्यागहस्तेन स गुरुर्मत्समस्स्मृतः ॥ २८ ॥"	[]
1	Chapter - 1	28	"यागानामपि तीर्थानां क्षेत्राणां सिद्धसेविनाम् ।  
पूजितानामर्चितानां पुष्पवस्त्रैश्च भूषणैः ॥ २९ ॥"	[]
1	Chapter - 1	29	"तथैवायतनानां च आश्रमाणां महामुने ।  
वेदगीतध्वनिभिस्तु हूयमाने हुताशने ॥ ३० ॥"	[]
1	Chapter - 1	30	"सन्दर्शनादकस्माच्च पुंसां सम्मूढचेतसाम् ।  
द्विषतां हेतुदुष्टानां नास्तिकानां सदैव हि ॥ ३१ ॥"	[]
1	Chapter - 1	31	"कुवासना कुबुद्धिश्च कुतर्कनिचयश्च यः ।  
कुभावश्च कुहेतुश्च नास्तिकत्वं लयं व्रजेत् ॥ ३२ ॥"	[]
1	Chapter - 1	32	"भाव (क्: हाव उत्पद्यते) उत्पद्यते क्षिप्रं तन्मध्ये श्रद्धयाऽन्वितम् ।  
तदीयेन प्रभावेन श्रद्धाद्याद्येषु किं पुनः ॥ ३३ ॥"	[]
1	Chapter - 1	33	"तस्माद्भक्तः परिज्ञेयश्शिष्यो गुणगणान्वितः ।  
तन्मयो नित्ययुक्तश्च विकल्पोज्झितमानसः ॥ ३४ ॥"	[]
1	Chapter - 1	34	"ब्राह्मणः क्षत्रियो वैश्यश्शूद्रो वा स्वपदस्थितः (क्: स्वपदे) ।  
ब्रह्मचारी गृहस्तो वा कृतकृत्यो यथाविधि ॥ ३५ ॥"	[]
1	Chapter - 1	35	"वानप्रस्थोऽथ भिक्षाशी नारी वा सद्विवेकिनी ।  
धीरस्स्वच्छस्सुसन्तुष्टस्तत्त्वदर्शनकाङ्क्षितः ॥ ३६ ॥"	[]
1	Chapter - 1	36	"बन्धुवर्गपरित्यागी उत्साही निश्चयान्वितः ।  
लब्ध्वा पात्रं * * * * यागदीक्षां समाप्य च ॥ ३७ ॥"	[]
1	Chapter - 1	37	"ततोऽग्नौ प्राकृतान् बन्धांस्तदीयाञ् जुहुयाद्गुरुः ।  
अतीतान् वर्तमानांश्च भविष्यान् कमलोद्भव ॥ ३८ ॥"	[]
1	Chapter - 1	38	"बन्धुसङ्घे परिक्षीणे शरीरिसकुलास्थितिः ? (ख्: शरीरी) ।  
तत्त्वव्याप्तिसमेता च वक्तेव्ये च यथास्थिति ॥ ३९ ॥"	[]
1	Chapter - 1	39	"तद्बुद्धिदर्पणोपेतान् हृदयस्थं तु सर्वगम् ।  
सर्वाभासमनाभासं (क्: सर्वभास) चित्सदानन्दलक्षणम् ॥ ४० ॥"	[]
1	Chapter - 1	40	"व्यक्ताव्यक्ततया मुक्तं निर्लेपं गगनोपमम् ।  
तेनेदं तदभिव्यक्तं यत्रस्थस्समतां व्रजेत् ॥ ४१ ॥"	[]
1	Chapter - 1	41	"कृतकृत्यं तु सञ्ज्ञात्वा ज्ञानतत्वं विमृश्य च (क्, ग्: विमृज्य च) ।  
संसारभयभीरूणामवश्यं सततं त्वया ॥ ४२ ॥"	[]
1	Chapter - 1	42	"योजना च परे तत्त्वे कर्तव्या सम्परीक्ष्य च ।  
पात्रस्थमात्मज्ञानं च कृत्वा पिण्डं समुत्सृजेत् ॥ ४३ ॥"	[]
1	Chapter - 1	43	"नान्तर्धानं यतो याति (ख्: यथा याति) जगद्बीजमबीजकृत् ।  
पावनं परमं ज्ञानमज्ञानतिमिरापहम् ॥ ४४ ॥"	[]
1	Chapter - 1	44	"कालेन (क्, ग्: कालेनाभ्यनन्त्वच्छयोक्तोयागादि; ख्: कालेनाभ्यन्वगच्छध्वं युक्तोवागादि) * * * * * * * यागादिदीक्षया ।  
भीरूणामप्रबुद्धानां जितस्यानव्यवस्थिते ? ॥ ४५ ॥"	[]
1	Chapter - 1	45	"यद्यन्तरा विपद्यन्ते किं स्यात्तेषाम् तदुच्यते ? ।  
असमाप्तक्रियाणां च त्वल्लब्धज्ञानिनां विभो ॥ ४६ ॥"	[]
1	Chapter - 1	46	"फलं सङ्कल्पपूर्वं स्याद्विद्धि तीव्रतरं नृणाम् ।  
क्रियानिर्वहणात्तात सङ्कल्पोऽसाधितस्य च ॥ ४७ ॥"	[]
1	Chapter - 1	47	"यदैवालङ्कृता बुद्धिर्नागतल्पेऽर्पयाम्यहम् ।  
भवाम्भोधिमपारं च आश्रमी परमं पदम् ॥ ४८ ॥"	[]
1	Chapter - 1	48	"तदेव साधितं तेन शाश्वतं पदमव्ययम् ।  
सिद्धश्च सिध्यमानश्च तृतीयश्चारुरुक्षकः ॥ ४९ ॥"	[]
1	Chapter - 1	49	"समत्वमेषां वै विद्धि किञ्चित्कालान्तरेण तु ।  
यथैकस्तिष्ठते तृप्तः पूर्वाशी सिद्धभोजनः ॥ ५० ॥"	[]
1	Chapter - 1	50	"अन्यश्च विद्ध्यनाहारो बेला तस्येन्द्र ? वर्तते ।  
अवसानेषु सर्वेषामतृप्तिर्नागुणस्स्मृतः ॥ ५१ ॥"	[]
1	Chapter - 1	51	"एवं मन्त्रक्रियायोगे भक्तानां कमलोद्भव   
कालेन स्वमते (स्वमतेशस्ति द्वे) शास्त ? द्वे तस्मिन्नव्यये पदे ॥ ५२ ॥"	[]
1	Chapter - 1	52	"भक्तिश्रद्धासमेतानां नृणां मन्त्रपरिग्रहः ।  
संसारोत्तारकश्शश्वद्यया वै (क्, ग्: वै ततवद्विजः) तत्त्वविद्द्विजः ॥ ५३ ॥"	[]
1	Chapter - 1	53	"मतिनिष्ठा प्रमेयं च विकल्पैरप्यनावृतम् ।  
लसत्समाधिनिष्ठेभ्यस्सकाशाज्जन्मना सह ॥ ५४ ॥"	[]
2	Chapter - 2	1	"भगवन् मण्डलानां च लक्षणं प्रब्रवीहि मे ।  
एषामुक्तस्त्वनन्तस्तु प्रवासं ? च स्वयं च यः ॥ १ ॥"	[]
2	Chapter - 2	2	"पुण्यदेशं समासाद्य प्रसिद्धं सिद्धसेवितम् ।  
तत्रानेकप्रकाराणि स्थानानि कमलोद्भव ॥ २ ॥"	[]
2	Chapter - 2	3	"धान्याश्रितमहीभागे लक्षणे सुपरीक्षिते ।  
प्रवर्तन्ते च यागानि तानि ते कथयाम्यहम् ॥ ३ ॥"	[]
2	Chapter - 2	4	"पर्वताग्रे च तन्मध्ये सानुदेशे द्विजोचिते (ख्: विभाजिते) ।  
भूगते तु वने रम्ये पादपौषधिसङ्कुले ॥ ४ ॥"	[]
2	Chapter - 2	5	"भद्रे चोपवने ह्यद्य (हृद्ये ?) प्रशस्ते कमलान्विते ।  
कूलेषु निम्नगानां तु तासामपि च सङ्गमे ॥ ५ ॥"	[]
2	Chapter - 2	6	"समीपे पुण्यतीर्थानां सुस्थिरे सारसाकुले (क्, ग्: सारससङ्कुले) ।  
देवतायतनोद्देशे गोष्ठेषु ब्राह्मणाश्रमे ॥ ६ ॥"	[]
2	Chapter - 2	7	"दुष्टप्राणिविनिर्मुक्ते चोरातङ्क भयादिके (भयोज्झिते इति चेत् साधु) ।  
तत्र भूमिं परीक्ष्यादौ लक्षणाढ्यां (ग - लक्षणार्थाम्) सुलक्षिताअम् (ख्: सुरक्षिताम्) ॥ ७ ॥"	[]
2	Chapter - 2	8	"देवनामालयार्थं तु ग्रामार्थं ब्राह्मणादिषु ।  
यजनार्थं तु यागानां गृहार्थं गृहमेधिनाम् ॥ ८ ॥"	[]
2	Chapter - 2	9	"धराधरवशो ? ह्यावे ? विना ब्रह्मन् गुणागुणाः ।  
सन्ति भूमेस्समासेन तन्मे निगदतश्शृणु ॥ ९ ॥"	[]
2	Chapter - 2	10	"यस्मात् क्ष्मा दोषनिर्मुक्ता करोत्यर्थक्रियां सदा ।  
सा तु दोषवती भूमिर्विघ्नानुत्पादयेद्बहून् ॥ १० ॥"	[]
2	Chapter - 2	11	"प्रभावादस्त्रमन्त्राणां पिशाचैस्त्यज्यतेऽब्जज ।  
या प्रशान्तद्रुमोपेता फलपुष्पसमाकुला ॥ ११ ॥"	[]
2	Chapter - 2	12	"स्निग्धशष्पसमाकीर्णा संयुक्ता मृदुभिस्तृणैः ।  
सुस्पर्शा स्निग्धतोया च गन्धाढ्या मधुरासिता ॥ १२ ॥"	[]
2	Chapter - 2	13	"अनूपरा ह्यदग्धा च पावकोल्कार्करश्मिभिः ।  
दुर्गन्धाद्यैर्महादोषैर्निर्मुक्ता सुखशान्तिदा ॥ १३ ॥"	[]
2	Chapter - 2	14	"दुष्टजन्तुविनिर्मुक्ता सेविता सत्पतत्रिभिः ।  
यत्र राजन्ति (रज्यन्ति इति स्यात् किम्) वै गावस्तथाऽन्ये मृगजातयः ॥ १४ ॥"	[]
2	Chapter - 2	15	"यत्र मोदन्ति वै व्याघ्रकुञ्जरास्सह मानवैः ।  
जनयत्याशु चाह्लादं स्वकान्तास्विव दर्शनम् ॥ १५ ॥"	[]
2	Chapter - 2	16	"सर्वेषां सर्वदा सा भूश्शुभदा चार्चनादिषु ।  
कुमुदोत्पलकह्लारैराकुला सारसादिभिः ॥ १६ ॥"	[]
2	Chapter - 2	17	"पूर्वे सरोवरं यस्या ह्यपरे आम्रकाननम् ।  
महच्छरवणं वामे शस्तो दक्षिणतो नगः ॥ १७ ॥"	[]
2	Chapter - 2	18	"समेकवर्णा सर्पाद्यैर्निर्मुक्ता चापि शस्यते ।  
वापीकूपादिकं खातमीशाने यस्य चोत्तरे ॥ १८ ॥"	[]
2	Chapter - 2	19	"शुभलक्षणयुक्ता सा सर्वसिद्धिकरी मही ।  
शीतरश्मिसमस्पर्शा निदाघे तु शुभावनी ॥ १९ ॥"	[]
2	Chapter - 2	20	"अत्युष्णा या च हेमन्ते रसान्वा ? जलदागमे ।  
कांस्यभाण्डस्वना (ख्: कांस्यभाण्डरवावापि वीणावंशरवाश्शुभाः) घण्टा वीणावंशरवाश्शुभाः ॥ २० ॥"	[]
2	Chapter - 2	21	"मृदङ्गदुन्दुभिरवा सर्वकामफलप्रदा ।  
समार्धं वा समं खात्वा पांसुमुद्धृत्य पूरयेत् ॥ २१ ॥"	[]
2	Chapter - 2	22	"अधिकेन भवेच्छ्रेष्ठा मध्यमा स्यात् समेन तु ।  
अपूर्णामधमां विद्धि दुरितां तां परित्यजेत् ॥"	[]
2	Chapter - 2	23	"त्रिपञ्चसप्तरात्रेण यस्यां बीजं प्ररोहति ।  
प्रधाना मध्यमा न्यूना सा मही परिकीर्तिता ॥ २३ ॥"	[]
2	Chapter - 2	24	"प्रागुत्तरप्लवा शस्ता सदैसानप्लवा द्विज ।  
कूर्मपृष्ठोन्नता योग्या सुशुभा दर्पणोदरा ॥ २४ ॥"	[]
2	Chapter - 2	25	"शङ्खचक्रगदापद्मश्रीवत्सगरुडाकृतिः ।  
मालामुकुटरूपा च सर्वसिद्धिकरी मही ॥ २५ ॥"	[]
2	Chapter - 2	26	"अतोऽन्या विपरीता च साऽनिष्टफलदा सदा ।  
दूरतः परिहर्तव्या सिद्धिहानिकरी यतः ॥ २६ ॥"	[]
2	Chapter - 2	27	"उक्तलक्षणसंयुक्ता यदि न प्राप्स्यते मही ।  
स्वीकृत्य सर्वसामान्यां पूज्य मन्त्रांस्तु ? तैर्यजेत् ॥ २७ ॥"	[]
2	Chapter - 2	28	"तत्रैवास्तूत्तमं ? सम्यक् सङ्ख्याहीनं च होमयेत् ।  
निराज्ये बहुनाऽज्येन मध्यदेशे यथास्थिते ॥ २८ ॥"	[]
2	Chapter - 2	29	"वृक्षं वै सोत्थितं ? चैत्यकुड्यप्रासादजं तथा ।  
त्यक्त्वा तु द्विगुणात्मानं भायामिध्मनि (ख्: छाया) गर्भवत् ॥ २९ ॥"	[]
2	Chapter - 2	30	"शुभेऽनुकूलेऽथ दिने कुर्याद्भूमिपरिग्रहम् ।  
अहिंसितेन मांसेन सक्तुना सोदकेन तु ॥ ३० ॥"	[]
2	Chapter - 2	31	"फलपुष्पसमेतेन तैलक्षारान्वितेन च ।  
स्विन्ने संस्पर्शसङ्घेन दधिक्षीरगुलेन च ॥ ३१ ॥"	[]
2	Chapter - 2	32	"रजनीचूर्णयुक्तेन शाङ्बलेन तिलेन च ।  
दिग्विदिक्षु तथा मध्ये त्विदमुक्त्वा बलिं क्षिपेत् ॥ ३२ ॥"	[]
2	Chapter - 2	33	"येषां वै क्रूरसत्त्वानामयं भूभागं आश्रयः ।  
ते प्रयच्छन्तु मे तुष्टिं प्रयान्तु परमालयम् ॥ ३३ ॥"	[]
2	Chapter - 2	34	"ध्यात्वाऽस्त्रसदृशं देहमस्त्रमन्त्रेण चोज्ज्वलम् ।  
भूतान्याज्ञापयेत् पश्चात् तोयान्तां निखनेन्महीम् ॥ ३४ ॥"	[]
2	Chapter - 2	35	"नरोज्ञोयम् ? समो वाऽथ शमेनैकेन वीथिकाम् ।  
सुशुद्धासु समाहूय गन्धाढ्याञ्चिदसंयुता ॥ ३५ ॥"	[]
2	Chapter - 2	36	"तया सम्पूर्य तद्गर्तमाठकाप्रहरे ? महीम् ।  
पश्चात् समैस्तृणैर्ब्रीहिपूर्णां पादपपल्लवैः ॥ ३६ ॥"	[]
